KEY,en,notes,sp,fr,de,it,pt-br
CUTSCENE_GUILLOTINA_2_REMATCH,Гильотина возвращается!,,¡Guillotina vuelve!,Guillotina est revenue&nbsp;!,Guillotina kehrt zurück!,Guillotina sta tornando!,Guilhotina está voltando!
CUTSCENE_GUILLOTINA_3,Гильотина жаждет мести!,,¡Guillotina tiene sed de venganza!,Guillotina cherche à se venger&nbsp;!,Guillotina hat es auf Rache abgesehen!,Guillotina vuole vendetta!,Guilhotina está em busca de vingança!
CUTSCENE_GUILLOTINA_3_REMATCH,Гильотина жаждет мести!,,¡Guillotina tiene sed de venganza!,Guillotina cherche à se venger&nbsp;!,Guillotina hat es auf Rache abgesehen!,Guillotina vuole vendetta!,Guilhotina está em busca de vingança!
CUTSCENE_PYROPHINA,Пирофина уже в пути!,,¡Pyrophina está en camino!,Pyrophina est en chemin&nbsp;!,Pyrophina ist auf dem Weg!,Pyrophina è in arrivo!,Pyrophina está a caminho!
CUTSCENE_PYROPHINA_REMATCH,Пирофина уже в пути!,,¡Pyrophina está en camino!,Pyrophina est en chemin&nbsp;!,Pyrophina ist auf dem Weg!,Pyrophina è in arrivo!,Pyrophina está a caminho!
CUTSCENE_ZARATANA,Заратана уже в пути!,,¡Zaratana está en camino!,Zaratana est en chemin&nbsp;!,Zaratana ist auf dem Weg!,Zaratana è in arrivo!,Zaratana está a caminho!
CUTSCENE_ZARATANA_REMATCH,Заратана уже в пути!,,¡Zaratana está en camino!,Zaratana est en chemin&nbsp;!,Zaratana ist auf dem Weg!,Zaratana è in arrivo!,Zaratana está a caminho!
CUTSCENE_KAIJUFIGHT,Кайдзю идут в атаку!,,¡Los kaijus te involucran en su enfrentamiento!,Les kaijus cherchent la bagarre&nbsp;!,Die Kaijus wollen kämpfen!,I kaijus vogliono combattere!,Os kaijus estão trazendo a luta até você!
CUTSCENE_KAIJUFIGHT_REMATCH,Кайдзю идут в атаку!,,¡Los kaijus te involucran en su enfrentamiento!,Les kaijus cherchent la bagarre&nbsp;!,Die Kaijus wollen kämpfen!,I kaijus vogliono combattere!,Os kaijus estão trazendo a luta até você!
CUTSCENE_TERMINATOR_1,C-800 охотится на тебя!,,¡El C-800 te busca!,C-800 vous cherche&nbsp;!,Der C-800 ist auf der Suche nach dir!,Il C-800 ti cerca!,G-800 está procurando você!
CUTSCENE_TERMINATOR_1_REMATCH,C-800 охотится на тебя!,,¡El C-800 te busca!,C-800 vous cherche&nbsp;!,Der C-800 ist auf der Suche nach dir!,Il C-800 ti cerca!,G-800 está procurando você!
CUTSCENE_TERMINATOR_2,C-1000 на охоте!,,¡El C-1000 está al acecho!,C-1000 vous traque&nbsp;!,Der C-1000 geht auf Beutejagd!,Il C-1000 è in agguato!,G-1000 está à espreita!
CUTSCENE_TERMINATOR_2_REMATCH,C-1000 на охоте!,,¡El C-1000 está al acecho!,C-1000 vous traque&nbsp;!,Der C-1000 geht auf Beutejagd!,Il C-1000 è in agguato!,G-1000 está à espreita!
CUTSCENE_TERMINATOR_3,Гитлер вернулся!,,¡Hitler ha vuelto!,Hitler est de retour&nbsp;!,Hitler ist zurückgekehrt!,Hitler è tornato!,Hitler voltou!
CUTSCENE_TERMINATOR_3_REMATCH,Гитлер вернулся!,,¡Hitler ha vuelto!,Hitler est de retour&nbsp;!,Hitler ist zurückgekehrt!,Hitler è tornato!,Hitler voltou!
,,,,,,,
//npc favor unlocks,,,,,,,
FAVOR_BEANIES_INTRO,Спецзадание.,,Un encargo especial.,Un travail spécial.,Eine ganz besondere Aufgabe.,Un incarico speciale.,Um trabalho especial.
FAVOR_BEANIES_REPEAT,Предмет побочного квеста.,,Un objeto de misión secundaria.,Un objet de quête secondaire.,Ein Gegenstand für eine Nebenquest.,Un oggetto per una missione secondaria.,Um item de missão secundária.
FAVOR_BUTCH_UPGRADE,Расширь хранилище предметов.,,Mejora tu almacén de objetos.,Une amélioration pour le rangement de vos objets.,Wertet deinen Lagerplatz auf.,Potenzia il deposito oggetti.,Aprimore seu armazenamento de itens.
FAVOR_TINK_BOW,Это секрет!,,¡Es un secreto!,C'est un secret&nbsp;!,Ein Geheimnis!,È un segreto!,É segredo!
FAVOR_TINK_TAGS,Помощь в организации котов.,,Algo para ayudarte a organizar los gatos.,Quelque chose pour mieux organiser vos chats.,"Etwas, das dir hilft, deine Katzen zu sortieren.",Qualcosa per aiutarti a organizzare i tuoi gatti.,Algo para ajudar você a organizar seus gatos.
FAVOR_TINK_BASESTATS,Информация для разведения котов.,,Información para ayudarte a hacer que los gatos se apareen.,Des informations pour le croisement des chats.,Information über das Züchten von Katzen.,Informazioni per aiutarti ad allevare i gatti.,Informações para ajudar a cruzar gatos.
FAVOR_TINK_INBREEDING,Способ проверить родословную кота.,,Una forma de comprobar la ascendencia de un gato.,Une manière d'en savoir plus sur la généalogie d'un chat.,"Eine Möglichkeit, die Abstammung deiner Katzen anzuzeigen.",Un modo per verificare la discendenza di un gatto.,Uma forma de conferir a árvore genealógica do seu gato.
FAVOR_TINK_AGRESSION,Информация о мурчности кота.,,Información para comprender mejor la personalidad de un gato.,Des informations pour comprendre la personnalité d'un chat.,Infos über die Persönlichkeit deiner Katzen.,Informazioni per aiutarti a capire la personalità di un gatto.,Informações para ajudar você a compreender a personalidade de um gato.
FAVOR_TINK_SEXUALITY,Гейдар.,,Gaydar.,Un gaydar.,Gaydar.,Gaydar.,Gaydar.
FAVOR_TINK_RELATIONSHIPS,Инфо о связях кота.,,Información para comprender mejor las relaciones de un gato.,Des informations pour comprendre les relations d'un chat.,Infos über die Beziehungen deiner Katzen.,Informazioni per aiutarti a capire le relazioni di un gatto.,Informações para ajudar você a compreender os relacionamentos de um gato.
FAVOR_TINK_MAX,25 монет,,25 monedas.,25&nbsp;pièces.,25&nbsp;Münzen,25 monete.,25 moedas.
FAVOR_FRANK_ATTIC,Чердак.,,Un desván.,Un grenier.,Ein Dachboden.,Una soffitta.,Um sótão.
FAVOR_FRANK_ROOM,Ещё одна комната для дома.,,Otra habitación para tu casa.,Une autre pièce dans votre maison.,Ein neues Zimmer für dein Haus.,Un'altra stanza per la tua casa.,Outro cômodo para a sua casa.
FAVOR_FRANK_PARASITE,Случайный паразит.,,Un parásito al azar.,Un parasite au hasard.,Ein zufälliger Parasit.,Un parassita casuale.,Um parasita aleatório.
FAVOR_JACK_UPGRADE,Больше мебели в продаже.,,Más muebles a la venta.,Plus de meubles à vendre.,Mehr Möbel zum Verkauf.,Altri mobili in vendita.,Mais móveis à venda.
FAVOR_JACK_MAX,Шанс редкой мебели в магазине растёт.,,Aumenta la probabilidad de que haya muebles inusuales en la tienda.,Augmentation de la probabilité de meubles rares dans la boutique.,Erhöht die Wahrscheinlichkeit für seltene Möbel im Shop.,Aumenta la probabilità di trovare mobili rari nel negozio.,Aumenta a chance de móveis raros na loja.
FAVOR_TRACY_FOOD,Пополняет коробку еды.,,Pone a la venta una caja de comida.,Garde une boîte de nourriture.,Bietet eine Futterbox zum Verkauf an.,Contiene una scatola di cibo.,Armazena uma caixa de comida.
FAVOR_TRACY_COLLAR,Пополняет чистый ошейник.,,Pone a la venta un collar en blanco.,Garde un collier vierge.,Bietet ein leeres Halsband zum Verkauf an.,Contiene un collare in bianco.,Armazena uma coleira vazia.
FAVOR_TRACY_IDOL,Пополняет спецмебель идол.,,"Pone a la venta un ídolo, un mueble especial.",Garde une idole spéciale.,Bietet ein besonderes Idol zum Verkauf an.,Contiene un idolo d'arredamento speciale.,Armazena um ídolo de móvel especial.
FAVOR_TRACY_RARE,Редкий предмет по дешёвке.,,Pone a la venta un objeto inusual barato al azar.,Garde un objet rare aléatoire pour pas cher.,Bietet einen zufälligen seltenen Gegenstand zum Sonderpreis an.,Contiene un oggetto raro casuale a basso prezzo.,Armazena um item raro aleatório de baixo custo.
FAVOR_GRINDER_UPGRADE,Больше барахла из провальных прогонов.,,Recupera más cosas de las partidas perdidas.,Récupère plus d'objets des parties perdues.,Rettet mehr Gegenstände nach verlorenen Abenteuern.,Recupera più oggetti dalle partite fallite.,Recupera mais coisas de partidas perdidas.
FAVOR_GRINDER_SYRINGE,Случайный шприц расстройства.,,Una jeringuilla que inflige un trastorno al azar.,Une seringue d'un trouble au hasard.,Eine Spritze mit einer zufälligen Krankheit.,Una siringa per un disturbo casuale.,Uma seringa com um transtorno aleatório.
